{
  "plan_id": "PLAN-M11-MILESTONE-REPORT",
  "type": "compiled-plan",
  "status": "approved",
  "milestone": "M11",
  "tickets": ["T11.8"],
  "dependencies": ["T11.5"],
  "execution_order": ["T11.8"],
  "immutable": true,
  "compiled_at": "2026-05-22T18:00:00Z",
  "approved_at": "2026-05-22T18:00:00Z",
  "traceability": [
    {
      "source": "FEATURE-002",
      "compilation_step": "single-ticket-plan",
      "description": "Extend pm-report.js with --milestone flag for focused milestone reports"
    }
  ]
}
